{"$schema":"https://json-schema.org/draft/2020-12/schema","$id":"https://tessivum.dev/schemas/conformance/v1","title":"Tessivum Conformance Fixture v1","type":"object","required":["schemaVersion","name","domain","scenario","expectedTrace"],"properties":{"schemaVersion":{"const":"tessivum.conformance/v1"},"name":{"type":"string","minLength":1,"pattern":"^[a-z][a-z0-9]*(?:[.-][a-z0-9]+)*$"},"domain":{"enum":["lifecycle","service","event","loader"]},"scenario":{"type":"string","minLength":1,"pattern":"^[a-z][a-z0-9]*(?:[.-][a-z0-9]+)*$"},"input":{},"expectedTrace":{"type":"array","items":{"$ref":"#/$defs/traceEvent"}}},"additionalProperties":false,"$defs":{"traceEvent":{"type":"object","required":["event"],"properties":{"event":{"enum":["fiber-created","fiber-state-changed","service-provided","service-removed","listener-added","listener-removed","event-dispatched","effect-created","effect-disposed","plugin-error","config-committed","config-rolled-back"]},"subject":{"type":"string","minLength":1},"from":{"type":"string","minLength":1},"to":{"type":"string","minLength":1},"label":{"type":"string","minLength":1},"phase":{"type":"string","minLength":1},"value":{},"error":{"type":"string","minLength":1}},"additionalProperties":false}}}
