{
  "schemaVersion": "tessivum.conformance/v1",
  "name": "event.core-catalog",
  "domain": "event",
  "scenario": "event-catalog",
  "input": {
    "cases": [
      {"id": "emit-ordering"},
      {"id": "parallel-aggregate"},
      {"id": "serial-bail"},
      {"id": "sync-bail"},
      {"id": "waterfall-next"},
      {"id": "waterfall-short-circuit"},
      {"id": "waterfall-wrap"},
      {"id": "prepend"},
      {"id": "scoped-filter"},
      {"id": "listener-self-removal"},
      {"id": "owner-disposal-during-dispatch"}
    ]
  },
  "expectedTrace": [
    {"event": "event-dispatched", "subject": "emit-ordering", "phase": "emit", "value": {"calls": ["first", "second"]}},
    {"event": "event-dispatched", "subject": "parallel-aggregate", "phase": "parallel", "value": {"calls": ["first", "second", "third"], "errors": 2}},
    {"event": "event-dispatched", "subject": "serial-bail", "phase": "serial", "value": {"calls": ["null", "false", "stop"], "result": "stop"}},
    {"event": "event-dispatched", "subject": "sync-bail", "phase": "bail", "value": {"calls": ["null", "false", "stop"], "result": "stop"}},
    {"event": "event-dispatched", "subject": "waterfall-next", "phase": "waterfall", "value": {"calls": ["first", "second"], "result": {"next": "start"}}},
    {"event": "event-dispatched", "subject": "waterfall-short-circuit", "phase": "waterfall", "value": {"calls": ["veto"], "result": {"veto": "blocked"}}},
    {"event": "event-dispatched", "subject": "waterfall-wrap", "phase": "waterfall", "value": {"calls": ["before", "terminal", "after"], "result": {"outer": {"terminal": {"inner": "start"}}}}},
    {"event": "event-dispatched", "subject": "prepend", "phase": "emit", "value": {"calls": ["prepend", "first", "second"]}},
    {"event": "event-dispatched", "subject": "scoped-filter", "phase": "emit", "value": {"calls": ["alpha"]}},
    {"event": "event-dispatched", "subject": "listener-self-removal", "phase": "emit", "value": {"dispatches": [["self", "stable"], ["stable"]]}},
    {"event": "event-dispatched", "subject": "owner-disposal-during-dispatch", "phase": "serial", "value": {"dispatches": [["dispose", "downstream"], []]}}
  ]
}
