{
  "schemaVersion": "tessivum.conformance/v1",
  "name": "service.core-catalog",
  "domain": "service",
  "scenario": "service-catalog",
  "input": {
    "cases": [
      {"id": "late-provider", "required": "clock"},
      {"id": "provider-replacement", "service": "theme"},
      {"id": "provider-removal-recovery", "service": "cache"},
      {"id": "optional-dependency", "optional": "metrics"},
      {"id": "duplicate-provider", "service": "logger"},
      {"id": "isolate-realms", "service": "storage", "realms": ["alpha", "beta"]},
      {"id": "shared-realm", "service": "bus", "realm": "shared"},
      {"id": "intercept-merge", "service": "config"},
      {"id": "stale-generation", "service": "session"}
    ]
  },
  "expectedTrace": [
    {"event": "service-provided", "subject": "late-provider", "phase": "catalog", "value": {"readyBefore": false, "readyAfter": true, "visible": "wall"}},
    {"event": "service-provided", "subject": "provider-replacement", "phase": "catalog", "value": {"oldStale": true, "visible": "dark"}},
    {"event": "service-provided", "subject": "provider-removal-recovery", "phase": "catalog", "value": {"missingAfterRemoval": true, "oldStale": true, "visible": "new"}},
    {"event": "service-provided", "subject": "optional-dependency", "phase": "catalog", "value": {"ready": true, "visible": null}},
    {"event": "service-provided", "subject": "duplicate-provider", "phase": "catalog", "value": {"duplicateRejected": true, "visible": "first"}},
    {"event": "service-provided", "subject": "isolate-realms", "phase": "catalog", "value": {"alpha": "alpha", "betaMissing": true}},
    {"event": "service-provided", "subject": "shared-realm", "phase": "catalog", "value": {"visible": "shared"}},
    {"event": "service-provided", "subject": "intercept-merge", "phase": "catalog", "value": {"config": {"retry": {"backoff": "fast"}, "source": "child"}}},
    {"event": "service-provided", "subject": "stale-generation", "phase": "catalog", "value": {"oldStale": true, "visible": "dark"}}
  ]
}
